{
  "schema": "schematic-ir.v1",
  "name": "rc_low_pass_filter",
  "description": "First-order RC low-pass filter",
  "category": "Passive",
  "parts": [
    {
      "mpn": "DEMO-10K-0603-A",
      "type": "resistor",
      "value": 10000.0,
      "package": "0603",
      "v_rating": 50.0,
      "power_rating_w": 0.125
    },
    {
      "mpn": "DEMO-100N-0603-A",
      "type": "capacitor",
      "value": 1e-7,
      "package": "0603",
      "v_rating": 50.0,
      "power_rating_w": 0.0
    }
  ],
  "components": [
    { "role": "R1", "part_type": "resistor", "quantity": 1, "target_value": 10000.0, "package": "0603" },
    { "role": "C1", "part_type": "capacitor", "quantity": 1, "target_value": 1e-7, "package": "0603" }
  ],
  "nodes": ["VIN", "VOUT", "GND"],
  "connections": [
    { "role": "R1", "pin": "1", "node": "VIN" },
    { "role": "R1", "pin": "2", "node": "VOUT" },
    { "role": "C1", "pin": "1", "node": "VOUT" },
    { "role": "C1", "pin": "2", "node": "GND" }
  ]
}
