{
  "schema": "schematic-ir.v1",
  "name": "rl_low_pass_filter",
  "description": "First-order RL low-pass filter",
  "category": "Passive",
  "parts": [
    {
      "mpn": "DEMO-10K-0603-A",
      "type": "resistor",
      "value": 10000.0,
      "package": "0603",
      "v_rating": 50.0,
      "power_rating_w": 0.125
    },
    {
      "mpn": "DEMO-10U-0603-A",
      "type": "inductor",
      "value": 1e-5,
      "package": "0603",
      "v_rating": 0.0,
      "i_rating": 0.1,
      "power_rating_w": 0.0
    }
  ],
  "components": [
    { "role": "R1", "part_type": "resistor", "quantity": 1, "target_value": 10000.0, "package": "0603" },
    { "role": "L1", "part_type": "inductor", "quantity": 1, "target_value": 1e-5, "package": "0603" }
  ],
  "nodes": ["VIN", "VOUT", "GND"],
  "connections": [
    { "role": "R1", "pin": "1", "node": "VIN" },
    { "role": "R1", "pin": "2", "node": "VOUT" },
    { "role": "L1", "pin": "1", "node": "VOUT" },
    { "role": "L1", "pin": "2", "node": "GND" }
  ]
}
