{
	"schema":	"schematic-ir.v1",
	"name":	"usb_c_stm32_composed",
	"description":	"Gate4/7 composed expand from catalog blocks",
	"category":	"Gate7",
	"parts":	[{
			"mpn":	"DEMO-5K1-0603-A",
			"type":	"resistor",
			"value":	5100,
			"package":	"0603",
			"v_rating":	50,
			"power_rating_w":	0.125
		}, {
			"mpn":	"DEMO-5K1-0603-B",
			"type":	"resistor",
			"value":	5100,
			"package":	"0603",
			"v_rating":	50,
			"power_rating_w":	0.125
		}, {
			"mpn":	"DEMO-10K-0603-A",
			"type":	"resistor",
			"value":	10000,
			"package":	"0603",
			"v_rating":	50,
			"power_rating_w":	0.125
		}, {
			"mpn":	"DEMO-10K-0603-B",
			"type":	"resistor",
			"value":	10000,
			"package":	"0603",
			"v_rating":	50,
			"power_rating_w":	0.125
		}, {
			"mpn":	"DEMO-10K-0603-C",
			"type":	"resistor",
			"value":	10000,
			"package":	"0603",
			"v_rating":	75,
			"power_rating_w":	0.25
		}, {
			"mpn":	"DEMO-4K7-0603-A",
			"type":	"resistor",
			"value":	4700,
			"package":	"0603",
			"v_rating":	50,
			"power_rating_w":	0.125
		}, {
			"mpn":	"DEMO-4K7-0603-B",
			"type":	"resistor",
			"value":	4700,
			"package":	"0603",
			"v_rating":	50,
			"power_rating_w":	0.125
		}, {
			"mpn":	"DEMO-330-0603-A",
			"type":	"resistor",
			"value":	330,
			"package":	"0603",
			"v_rating":	50,
			"power_rating_w":	0.125
		}, {
			"mpn":	"DEMO-330-0603-B",
			"type":	"resistor",
			"value":	330,
			"package":	"0603",
			"v_rating":	50,
			"power_rating_w":	0.125
		}],
	"components":	[{
			"role":	"usb_c_sink_cc",
			"part_type":	"resistor",
			"quantity":	1,
			"target_value":	5100,
			"package":	"0603"
		}, {
			"role":	"ldo_5v_fb",
			"part_type":	"resistor",
			"quantity":	1,
			"target_value":	10000,
			"package":	"0603"
		}, {
			"role":	"mcu_min_system_pu",
			"part_type":	"resistor",
			"quantity":	1,
			"target_value":	10000,
			"package":	"0603"
		}, {
			"role":	"i2c_temp_sensor_pull",
			"part_type":	"resistor",
			"quantity":	1,
			"target_value":	4700,
			"package":	"0603"
		}, {
			"role":	"status_led_rled",
			"part_type":	"resistor",
			"quantity":	1,
			"target_value":	330,
			"package":	"0603"
		}],
	"nodes":	["VBUS", "GND", "3V3"],
	"connections":	[{
			"role":	"usb_c_sink_cc",
			"pin":	"1",
			"node":	"VBUS"
		}, {
			"role":	"usb_c_sink_cc",
			"pin":	"2",
			"node":	"GND"
		}, {
			"role":	"ldo_5v_fb",
			"pin":	"1",
			"node":	"VBUS"
		}, {
			"role":	"ldo_5v_fb",
			"pin":	"2",
			"node":	"3V3"
		}, {
			"role":	"mcu_min_system_pu",
			"pin":	"1",
			"node":	"3V3"
		}, {
			"role":	"mcu_min_system_pu",
			"pin":	"2",
			"node":	"GND"
		}, {
			"role":	"i2c_temp_sensor_pull",
			"pin":	"1",
			"node":	"3V3"
		}, {
			"role":	"i2c_temp_sensor_pull",
			"pin":	"2",
			"node":	"GND"
		}, {
			"role":	"status_led_rled",
			"pin":	"1",
			"node":	"3V3"
		}, {
			"role":	"status_led_rled",
			"pin":	"2",
			"node":	"GND"
		}]
}
