{
  "schema": "schematic-ir.v1",
  "name": "sensor_supply_conditioning_macro_903",
  "description": "3V3 sensor rail divider + decoupling + LED (903 regression)",
  "category": "Power",
  "parts": [
    {
      "mpn": "DEMO-1K-0603-A",
      "type": "resistor",
      "value": 1000.0,
      "package": "0603",
      "v_rating": 50.0,
      "power_rating_w": 0.125
    },
    {
      "mpn": "DEMO-10K-0603-A",
      "type": "resistor",
      "value": 10000.0,
      "package": "0603",
      "v_rating": 50.0,
      "power_rating_w": 0.125
    },
    {
      "mpn": "DEMO-10UF-0603-A",
      "type": "capacitor",
      "value": 1e-5,
      "package": "0603",
      "v_rating": 50.0,
      "power_rating_w": 0.0
    },
    {
      "mpn": "DEMO-100N-0603-A",
      "type": "capacitor",
      "value": 1e-7,
      "package": "0603",
      "v_rating": 50.0,
      "power_rating_w": 0.0
    },
    {
      "mpn": "DEMO-330-0603-A",
      "type": "resistor",
      "value": 330.0,
      "package": "0603",
      "v_rating": 50.0,
      "power_rating_w": 0.125
    },
    {
      "mpn": "DEMO-LED-RED-0603-A",
      "type": "led",
      "value": 2.0,
      "package": "0603",
      "v_rating": 5.0,
      "i_rating": 0.02,
      "power_rating_w": 0.05
    }
  ],
  "components": [
    { "role": "R1", "part_type": "resistor", "quantity": 1, "target_value": 1000.0, "package": "0603" },
    { "role": "R2", "part_type": "resistor", "quantity": 1, "target_value": 10000.0, "package": "0603" },
    { "role": "C1", "part_type": "capacitor", "quantity": 1, "target_value": 1e-5, "package": "0603" },
    { "role": "C2", "part_type": "capacitor", "quantity": 1, "target_value": 1e-7, "package": "0603" },
    { "role": "RLED", "part_type": "resistor", "quantity": 1, "target_value": 330.0, "package": "0603" },
    { "role": "D1", "part_type": "led", "quantity": 1, "target_value": 2.0, "package": "0603" }
  ],
  "nodes": ["3V3", "SENSOR_VDD", "LED_A", "GND"],
  "connections": [
    { "role": "R1", "pin": "1", "node": "3V3" },
    { "role": "R1", "pin": "2", "node": "SENSOR_VDD" },
    { "role": "R2", "pin": "1", "node": "SENSOR_VDD" },
    { "role": "R2", "pin": "2", "node": "GND" },
    { "role": "C1", "pin": "1", "node": "SENSOR_VDD" },
    { "role": "C1", "pin": "2", "node": "GND" },
    { "role": "C2", "pin": "1", "node": "SENSOR_VDD" },
    { "role": "C2", "pin": "2", "node": "GND" },
    { "role": "RLED", "pin": "1", "node": "3V3" },
    { "role": "RLED", "pin": "2", "node": "LED_A" },
    { "role": "D1", "pin": "A", "node": "LED_A" },
    { "role": "D1", "pin": "K", "node": "GND" }
  ]
}
